{
  "$schema": "https://raw.githubusercontent.com/AngelMunoz/Perla/fs-rework/perla.schema.json",
  "schema-version": "2025-07",
  "provider": "jspm",
  "build": {
    "includes": ["src/todos.json"]
  },
  "dependencies": {
    "solid-js": "1.6.4",
    "solid-js/web": "1.6.4",
    "solid-js/html": "1.6.4"
  }
}
