{
  "$schema": "https://raw.githubusercontent.com/AngelMunoz/Perla/fs-rework/perla.schema.json",
  "schema-version": "2025-07",
  "provider": "jspm",
  "plugins": ["perla-esbuild-plugin"],
  "esbuild": {
    "jsxAutomatic": true
  },
  "dependencies": {
    "react": "18.2.0",
    "react-dom": "18.2.0"
  }
}
